{
  "$schema": "http://json-schema.org/draft-07/schema#",
  "$id": "soulforge/governance/releases",
  "title": "SoulForge 版本注册表与冻结保护",
  "type": "object",
  "additionalProperties": false,
  "required": ["schemaVersion", "currentRelease", "releases", "invariants"],
  "properties": {
    "schemaVersion": { "type": "string", "pattern": "^\\d+\\.\\d+\\.\\d+$" },
    "note": { "type": "string", "minLength": 1 },
    "currentRelease": {
      "type": ["string", "null"],
      "pattern": "^V\\d+\\.\\d+$",
      "description": "仅作发布工作流的可选指针；null 表示开发不绑定任何里程碑。"
    },
    "releases": {
      "type": "array",
      "minItems": 1,
      "items": {
        "type": "object",
        "additionalProperties": false,
        "required": [
          "release",
          "state",
          "frozen",
          "frozenScopeRulingRef",
          "frozenEvidenceRef",
          "frozenFields",
          "unfreezeRuling"
        ],
        "properties": {
          "release": { "type": "string", "pattern": "^V\\d+\\.\\d+$" },
          "state": { "enum": ["active", "planned", "released", "superseded"] },
          "frozen": { "type": "boolean" },
          "frozenScopeRulingRef": { "type": ["string", "null"], "pattern": "^W-[A-Z0-9-]+$" },
          "frozenEvidenceRef": { "type": ["string", "null"], "pattern": "^EV-[A-Z0-9-]+$" },
          "frozenFields": { "type": "array", "items": { "type": "string", "minLength": 1 } },
          "frozenFieldsNote": { "type": "string" },
          "unfreezeRuling": {
            "type": ["object", "null"],
            "additionalProperties": false,
            "required": ["status", "approvedBy", "approvedAt", "decisionRef", "scopeItemIds"],
            "properties": {
              "status": { "const": "user-approved" },
              "approvedBy": { "type": "string", "minLength": 1 },
              "approvedAt": { "type": "string", "minLength": 1 },
              "decisionRef": { "type": "string", "minLength": 1 },
              "scopeItemIds": {
                "type": "array",
                "minItems": 1,
                "items": { "type": "string", "minLength": 1 },
                "description": "本次解冻放开哪些 scopeItem 的裁定字段。**必填且非空**：解冻是按条目的，未列出的条目继续受 git 基线比对保护。若允许省略，一条裁定就会把该版全部裁定字段的保护一起关掉，而保护面变小不会有任何信号。"
              },
              "fieldPaths": {
                "type": "array",
                "uniqueItems": true,
                "items": { "type": "string", "minLength": 1 },
                "description": "可选的顶层冻结字段解冻清单。每一项必须精确匹配 frozenFields 中的顶层字段；未列出的顶层字段继续受 git 基线保护。"
              },
              "reason": { "type": "string", "minLength": 1 }
            }
          }
        }
      }
    },
    "invariants": { "type": "array", "minItems": 1, "items": { "type": "string", "minLength": 1 } }
  }
}
